{
  "type": "Template",
  "name": "content.tpl",
  "body": [
    {
      "type": "Text",
      "value": "<section data-react-island id=\"counter\">\n<p>",
      "span": [
        0,
        44
      ]
    },
    {
      "type": "Echo",
      "expr": {
        "type": "Var",
        "name": "island_label",
        "span": [
          47,
          59
        ]
      },
      "span": [
        44,
        60
      ]
    },
    {
      "type": "Text",
      "value": "</p>\n</section>\n",
      "span": [
        60,
        76
      ]
    }
  ],
  "comments": []
}
