{
  "type": "Template",
  "name": "input.tpl",
  "body": [
    {
      "type": "Echo",
      "expr": {
        "type": "Call",
        "name": "last",
        "args": [
          {
            "type": "Var",
            "name": "l",
            "span": [
              8,
              9
            ]
          }
        ],
        "span": [
          3,
          10
        ]
      },
      "span": [
        0,
        11
      ]
    },
    {
      "type": "Text",
      "value": "\n",
      "span": [
        11,
        12
      ]
    },
    {
      "type": "Echo",
      "expr": {
        "type": "Call",
        "name": "last",
        "args": [
          {
            "type": "Literal",
            "kind": "string",
            "value": "héllo",
            "span": [
              20,
              28
            ]
          }
        ],
        "span": [
          15,
          29
        ]
      },
      "span": [
        12,
        30
      ]
    },
    {
      "type": "Text",
      "value": "\n",
      "span": [
        30,
        31
      ]
    },
    {
      "type": "Echo",
      "expr": {
        "type": "Call",
        "name": "raw",
        "args": [
          {
            "type": "Call",
            "name": "json",
            "args": [
              {
                "type": "Call",
                "name": "last",
                "args": [
                  {
                    "type": "Literal",
                    "kind": "string",
                    "value": "",
                    "span": [
                      44,
                      46
                    ]
                  }
                ],
                "span": [
                  39,
                  47
                ]
              }
            ],
            "span": [
              34,
              48
            ]
          }
        ],
        "span": [
          34,
          54
        ]
      },
      "span": [
        31,
        55
      ]
    },
    {
      "type": "Text",
      "value": "\n",
      "span": [
        55,
        56
      ]
    }
  ],
  "comments": []
}
