{
  "type": "Template",
  "name": "input.tpl",
  "body": [
    {
      "type": "Set",
      "name": "x",
      "expr": {
        "type": "Literal",
        "kind": "number",
        "value": 1,
        "span": [
          6,
          7
        ]
      },
      "span": [
        0,
        8
      ]
    },
    {
      "type": "Text",
      "value": "[",
      "span": [
        9,
        10
      ]
    },
    {
      "type": "Block",
      "id": null,
      "path": "part.tpl",
      "scope": [],
      "span": [
        10,
        22
      ]
    },
    {
      "type": "Text",
      "value": "]\n",
      "span": [
        22,
        24
      ]
    }
  ],
  "comments": []
}
