{
  "type": "Template",
  "name": "input.tpl",
  "body": [
    {
      "type": "Echo",
      "expr": {
        "type": "Var",
        "name": "n",
        "span": [
          3,
          4
        ]
      },
      "span": [
        0,
        5
      ]
    },
    {
      "type": "Text",
      "value": "\n",
      "span": [
        5,
        6
      ]
    },
    {
      "type": "Echo",
      "expr": {
        "type": "Binary",
        "op": "+",
        "left": {
          "type": "Var",
          "name": "n",
          "span": [
            9,
            10
          ]
        },
        "right": {
          "type": "Literal",
          "kind": "number",
          "value": 1,
          "span": [
            13,
            14
          ]
        },
        "span": [
          9,
          14
        ]
      },
      "span": [
        6,
        15
      ]
    },
    {
      "type": "Text",
      "value": "\n",
      "span": [
        15,
        16
      ]
    }
  ],
  "comments": []
}
